[
  {
    "submission_id": "dev:SUB-001",
    "issue_id": "dev:ISS-001",
    "node_id": "dev",
    "author_id": "dev:schema-exercise",
    "type": "proposal",
    "created_at": "2026-05-30T12:00:00Z",
    "content": "Adopt candidate schema set v0.1 as the working baseline; open all 16 OQs for ratification; gate Phase 2 on OQ-01 + OQ-04.",
    "source_system": null,
    "source_ref": null,
    "embedding": null,
    "duplicate_of": null,
    "metadata": null
  },
  {
    "submission_id": "dev:SUB-002",
    "issue_id": "dev:ISS-001",
    "node_id": "dev",
    "author_id": "dev:validation",
    "type": "evidence",
    "created_at": "2026-05-30T12:00:00Z",
    "content": "All boundary-crossing JSON Schemas meta-validate; cross-$refs resolve; non-transferability and node-id:participant-id enforced; 'regional' rejected as a governance_scope. Evidence is a pass-through to Module 3, not clustered (Ep.59).",
    "source_system": null,
    "source_ref": null,
    "embedding": null,
    "duplicate_of": null,
    "metadata": null
  }
]